[
  {
    "id": "adagj-review-20260311-083620",
    "review_id": "adagj-review-20260311-083620",
    "review_date": "2026-03-11",
    "scope": "AI大管家日常 review",
    "summary": "skills_total=108 / status=resolved",
    "top_risks": [
      "人格说明型技能过多"
    ],
    "candidate_actions": [
      "处理外部高价值线索",
      "加厚高频 agency 技能",
      "处理重复和边界冲突"
    ],
    "human_decision": "",
    "sync_state": "unknown",
    "source_ref": "/Users/liming/.codex/skills/ai-da-guan-jia/artifacts/ai-da-guan-jia/reviews/2026-03-11/adagj-review-20260311-083620/review.json",
    "confidence": 0.9,
    "updated_at": "2026-03-14T21:48:39+08:00"
  }
]
